tweet_no	tweet_text	q1_label	q2_label	q3_label	q4_label	q5_label	q6_label	q7_label
441	-----------------------------------------------------------------------------------------------------------------------------------------------------------------------------------------------------------------------	yes	no	yes	no	no	no	no
442	Изпълнителната служба за преглед на имиграцията, която попада в приложното поле на Министерството на правосъдието, съобщи на всички съдии и служители в един имейл в понеделник, че всички коронавирусни плакати, които обясняват на английски и испански език как да се предотврати улавянето и разпространението на вируса, трябва да бъдат премахнати.	yes	no	yes	yes	yes	yes	yes
443	Ummm... изглежда, че може би трябва да включите тази част в туита си, вместо да участвате в масовата хистерия или в йт	yes	nan	yes	no	no	no	no
444	Ще ми обясните ли как съм оцеляла от	no	nan	nan	nan	nan	no	no
445	Страната е изпаднала в паника заради #coronavirus, но този сезон са се случили 9 милиона грипни заболявания, 87 000 хоспитализации и 4800 смъртни случая от грип, включително 32 смъртни случая в детска възраст. Време е да спрем паниката и да поставим нещата в перспектива.	yes	no	yes	no	yes	no	no
446	Той получи сълзливо око, говорейки за армия, той каза, че няма никаква енергия по време на бала, защото ние бяхме там, той щеше да се прибере по-рано след музиката и да изкрещи от неудовлетвореност, че цялата ситуация (корона) е толкова несправедлива.	no	nan	nan	nan	nan	no	no
447	Те са предатели на нашата нация, демокрация и конституция.	yes	nan	yes	yes	yes	yes	no
448	Административни нареждания Имиграционни служби за незабавно премахване на плакати, обясняващи как да се предотвратява #coronavirus	yes	nan	yes	yes	yes	yes	yes
449	Не мога да се запозная с нашите най-уязвими. Не мога да се изследва Нито един от нашите грижи не може да бъде изпитан.Моите пациенти не могат да се допитат.Семействата на моите пациенти не могат да се допитат. Членовете на семейството ми не могат да бъдат тествани и никой, когото познавам, не може да си позволи да пропуска работа.	yes	no	yes	yes	yes	yes	yes
450	Главно споделих тази история, защото искам хората да знаят колко трудно е дори да се тестват за #COVID19 в Мисури в момента. С такава тясна група от хора, които се изпитват, може наистина да знаят степента на огнището? Настоящата система изглежда доста глупаво.	yes	no	yes	yes	yes	yes	yes
451	Hello, 25th. Sandomy Riding Down Over Thisâ: Trump, Germaphobe in Change, Boggins to Control the Covid-19 Ur	no	nan	nan	nan	nan	no	no
505	Това беше един много специален момент за всички евреи и искам да благодаря на министър-председателя Моди за бързите, решителни и снизходителни действия, които ни позволяват да бъдем бенефициенти на тези ваксини.	yes	no	yes	no	no	no	no
506	Говори пред председателя @CyritralRamaphosa относно мерките, които Индия и Южна Африка предприемат, за да се борят срещу COVID-19 във вътрешен и международен план. Способността на Индия да произвежда лекарства и ваксини подкрепя усилията на много нации, включително нашите приятели в Африка.	yes	no	yes	no	no	no	no
507	Ние трябва да сложим край на тази пандемия и помощта е на път. И помощта е на път.	yes	no	yes	no	no	no	no
508	Но благодарение на Indian Health Service и силни партньорства с Tribal правителства, организации, и градски индиански групи, повече от 500 000 ваксини вече са приложени с повече по пътя.	yes	no	yes	no	no	no	no
509	Всички седем ваксини, които са завършили много клинични проучвания за ефикасност, са много ефективни по отношение на профилактиката на тежката СОVID.	yes	no	yes	no	no	no	no
510	Това е, което правя, докато чакам своя ред за ваксините COVID-19: маскиране, престой най-малко шест фута отделно от другите, избягване на тълпи, и не се събират вътре с хора, с които не живея. Ето как аз ще направя разлика и помощ #SlowTheSpread.	no	nan	nan	nan	nan	no	no
511	И така, маскирам се, избягвам тълпи, отбягвам тълпи, отсядам поне шест фута далеч от другите, и не се социализирам с хора, с които не живея. Ваксините могат да помогнат, но така може да помогне, но и аз.	yes	no	yes	no	no	no	no
512	На последно място, заявените в Индия искания за ваксини, които са предмет на програма „Европейски алианс за ваксини и имунизация“ в рамките на Глобалния алианс за ваксини и програми за имунизация.	yes	no	yes	no	no	no	no
513	Днес следобед съм на среща с изпълнителните директори на Johnson &ham; Johnson и Merck, за да обсъдим нашето историческо партньорство за производство на повече COVID-19. Tune in. https://t.co/S3OxWrOUgt	no	nan	nan	nan	nan	no	no
514	"И така, Европа има своя собствена система за докладване на нежелани събития за лекарства и ваксини, наречена ""ЕСТРА"". Вече има данни за ковидите, което се оказва, че е по-лошо от данните от САЩ. Сега съдържа 58,000 доклада за @pfizer самостоятелно, включително около 730 смъртни случая..."	yes	nan	yes	yes	yes	yes	yes
515	Обуй се, избягвай тълпите, и остани най-малко шест фута, докато не получим достатъчно от нас получете COVID-19 ваксини. #SlowTheSpread	no	nan	nan	nan	nan	no	no
516	- Израел отрича ваксина срещу палестинци, чиято земя и живот контролира. СЗО се е позовала на Израел: да не се налага.	yes	nan	yes	yes	yes	yes	yes
517	Забавен факт: ваксините с ноквидова кост в момента представляват повече доклади за нежелани реакции, от декември, отколкото през последната година, и 8 пъти повече от броя на смъртните доклади.	yes	yes	yes	yes	yes	yes	yes
518	Като част от провеждащата се провеждаща се инкубационна програма, която е видяла повече от 30 000 ваксинирани лица, президентът Kagame и първата лейди JeanNet Kagame получиха своите #COVID-19 в болница King Faisal. https://t.co/OyltTad9W	yes	no	yes	no	no	no	no
519	Направникът на Руанда е благодарен на правителството на Индия и на други страни партньори за техния ценен принос в борбата срещу #COVID19 @DrSJaidankar	yes	no	yes	no	no	no	no
520	Information on Zandeneca and SinoVac COVID -- Ваксини от UP-PGH COVID ----------------------------------------------------------------------------------------------------------------------------------------------------------------------------------------------------------------------------------------------------------------------------------------------------------------------------------------------------------------------------------------------------------------------------------------------------------------------------------------------	no	nan	nan	nan	nan	no	no
521	Стартира Глобална депресионизация на хомосексуалната кампания - по-слаба и изолирана.	yes	no	yes	no	no	no	no
522	Четирима бивши президенти са се обединили заедно за две национални рекламни кампании, публикувани в четвъртък, за да поддържат доверие в COVID-19 ваксини - и всички те са си представяли как са били ваксинирани срещу вируса https://t.co/nG9V6jalhl	yes	no	yes	no	no	no	no
523	С развитието на безопасни и ефективни ваксини COVID-19, имаме шанса да се издигнем до момента отново. https://t.co/rbuQustkH9R	no	nan	nan	nan	nan	no	no
524	Ние не се отнасяме към тях като към съществени. Те са от съществено значение. Те са жертвени. https://t.co/fZRrruG3to	yes	no	yes	yes	yes	no	yes
525	Има толкова много информация и страхопочитание около #COVID19 ваксини за бременни и кърмещи жени. A blyin @YalateMSTP student @Alliceluculligigan и аз написах това OpEd to dispel тези митове и да предостави съответните факти. Моля, споделете добре. https://t.co/iyneLwvE5y	no	nan	nan	nan	nan	no	no
526	Нови: Руските разузнавателни агенции са провели кампания за подкопаване на доверието в Pfizer и други Ковиди, като използват онлайн фронтови публикации, че през последните месеци са поставили под въпрос тяхното развитие и безопасност, заявиха представителите на САЩ. w/ @mgordonwsj https://t.co/x0P4rCiEAx	yes	nan	yes	yes	yes	yes	yes
527	Програмата за ваксинация в Индия се развива добре с две местни ваксини, кахидади и циваксин. Sa-Bhakti, дадена от @SaintRampalJiM е добре тествана ваксина. #COVIDVIDVacine #COVID19 #COVID_19 #COVIDVIDVVacine https://t.co/bpHVMCxfOj	yes	nan	yes	no	no	no	no
528	Аз съм д-р Антъни Фаучи, главен медицински съветник на президента и директор на @NIAIDNews, и ще прекарам следващия час или ще отговоря на въпросите ви относно COVID-19 и науката зад ваксините.	no	nan	nan	nan	nan	no	no
529	Световната здравна организация даде нови насоки относно Covid-19 на Modona тази седмица, като препоръча като цяло да се противопостави на употребата му при повечето бременни хора, като даде подобни указания за употребата на Pfizer и BioNTech шот https://t.co/Dyx2aSUD	yes	nan	yes	yes	yes	yes	yes
530	МАР: В името на Бога и семейството, не позволявайте на никого да удря вашите бебета с експерименталните COVID-19. https://t.co/0LIZf4dr	no	nan	nan	nan	nan	yes	yes
531	Това означава само, че % от хората, които не могат да получат COVID Всички изброени по-долу ваксини са ~100% ефективни за предотвратяване на СОВ	yes	no	yes	no	no	no	no
532	WSJ: Всички три от основните разузнавателни служби на Русия (СВР, ФСБ и ГРУ) са организирали фалшиви информационни сайтове и телефонни сметки в социалните мрежи, за да разпространят информацията за Ffeizer и Moderna ваксините в опит да подкопаят доверието в тях. https://t.co/t3kmCyevBFs via @WSJ	yes	nan	yes	yes	yes	yes	yes
533	Biden ще обяви тази вечер, че зъболекари, акушерки, парамедици, ветеринарни лекари, медицински студенти и други студенти и професионалисти в областта на здравеопазването ще могат да предписват Covid-19 ваксини сега.	yes	no	yes	no	no	no	no
534	Куба изпрати здравни специалисти до 40 страни по време на пандемията и е в крайните етапи на производството на 2 ваксини срещу Covid-19. -Най-лошият социализъм все още е по-добър от най-добрия Coling-G. Lukács	yes	no	yes	no	no	no	no
535	След три месеца на отлагане от страна на консерваторите, вчера те гласуваха против необходимото законодателство, което да осигури:	yes	no	yes	yes	yes	no	yes
536	Това е сърцето ми, че Индия изпраща безплатна COVIDID-19 на приятелски и далечни страни като Бразилия, Мароко, Южна Африка на хуманитарна основа. Светът не може да каже на Индия. #VaccineDiplopacy @UN https://t.t.co/vhLcfG7AQ	yes	no	yes	no	no	no	no
537	Ембид ще дари своята $100K ASW приходи на три бездомни приюта във Филаделфия, за да помогне да се осигури: -Мечта -Обезпокояване и грижи за тези, които получават COVID-19 ваксини -Фунди за летен лагер -Срещу 300+ тийнейджъри -Подкрепа за бивши бездомни семейства	yes	no	yes	no	no	no	no
538	Данните показват, че ваксините са изключително ефективни при предотвратяване на смърт от кожно заболяване и предотвратяване на предаване от кожно заболяване.	yes	no	yes	no	no	no	no
539	Но е важно да продължим да стоим на половин метър от другите, да носим маски и да избягваме тълпите, за да помогнем за забавяне на разпространението на COVID-19.	yes	no	yes	no	no	no	no
540	Учители, училищен персонал, както и работници в програмата за грижа за децата: @POTUS е предизвикателство, за да получите вашата първа #COVID19 до края на март. Федералната програма за търговия на дребно ще постави в приоритет своите ваксинации.	no	nan	nan	nan	nan	no	no
541	Това е за Бил Гейтс, и защо той отказва да подкрепи призиви за отпадане на патенти на Covid-19 ваксини. Аз го попитах лично по въпроса. https://t.co/EVDJQl1Qy	no	nan	nan	nan	nan	no	no
542	Премиерът го увери, че ще помогне. #VaccineMaitri поставя Индия на световната сцена отново за основните й ценности на хуманитаризъм & amp; доброжелателност.	no	nan	nan	nan	nan	no	no
543	@DDWWWWDELLLLA CVS е извършването на срещи, които са достъпни за пред-К през 12 педагози, служители и деца, работещи във всички 17 държави, в които понастоящем предлагаме COVID-19 ваксини, без възрастова граница за федерални насоки! Way to go, CVS!), https://t.co/jtUYMe3BcY	yes	no	yes	no	no	no	no
544	"Чували сме много за ""ваксина"" паспорти за тези, които са имали ваксината, но без да говорим за ""имунност"" за тези, които са имали Ковид и са развили естествен имунитет."	no	nan	nan	nan	nan	no	yes
545	Всеки продължава да сравнява различните ваксини, и честно казано, аз съм на мястото, където ще взема една, произведена от	no	nan	nan	nan	nan	no	no
546	"""Действието може да се приеме сега, за да се гарантира, че Канада може да произвежда свои собствени ваксини, без да се налага да разчита единствено на международни партньори."" @Mosssmanlab прави случая за @MacGlobalNexusitzhenry Vector Lab за производство на ваксини COVID-19 за всички канадци. https://t.co/J3Nvb5faq6"	yes	no	yes	no	no	no	no
547	Канада има следните търговски споразумения за COVID-19 vaccine - Pfizer: до 76 милиона дози Moderna: 44m AstraZeneca: 20m AstraZeneca от SII: 2m Това са търговски споразумения и никоя друга страна не прави такава песен и не танцува за доставянето на ваксини. https://t.co/ATMa1rC8uz	yes	no	yes	no	no	no	no
548	Това е първата държава, която трябва да се разшири до всички възрасти, които са одобрени за приемане на самостоятелни дози. https:://t.co/ugHNqAaa	yes	no	yes	no	no	no	no
549	За изследователите, които са разработили ваксини, ние ви благодарим. https://t.co/Aff9DtZ5jD	no	nan	nan	nan	nan	no	no
550	"Iransrans забрани вноса на Великобритания и US Covid-19 ваксини, като каза, че те са ""наистина не-не-не-не-не"" https:://t.co/gdiFitSWHD"	yes	no	yes	yes	yes	yes	yes
551	Доставката е там, @GovRonDeSantis - време е да се отвори и спаси животи. https://t.co/YkJGGHqTG	no	nan	nan	nan	nan	no	no
552	ГОЛЯМИТЕ НА COVID-19 VACCINES! Г-н Ламанша предупреждава за опасността от причиняваната от Pfizer и Moderna #COVID19 #Covidronavirus #CovidVaccinations #VacunaCOVID19 #vaccineStrategy #NewWorderOderder https://t.co/K0LkFrab0W	no	nan	nan	nan	nan	yes	yes
553	Макдоналдс Филипините са закупили близо до 100 до 100 до 100 дози СОВИД-19 ваксини от AstraZeneca, тъй като операторът на бързооборотната верига заяви, че възнамерява да ваксинира служителите си безплатно. https://t.co/zG8pwZ8c1G	yes	no	yes	no	no	no	no
554	Последните ваксини: Миналата седмица получихме почти 1 милион дози COVID-19 ваксини и ще получим още един милион тази седмица, преди края на месеца ще сме получили общо 8 милиона дози COVID-19 ваксини за хора от цялата страна.	yes	no	yes	no	no	no	no
555	#COVISID19 ваксини са безопасни за хора, живеещи с HIV! Научете повече за COVID-19 ваксини и HIV тук	yes	no	yes	no	yes	no	no
556	Напомняне: • Коронавирусната ваксина не може да ви даде COVIDID- 19. • Грената във ваксината не се превръща в постоянна част от тялото Ви. • Pfizer, Moderna и J&amp;J всички имат силно ефективни и сигурни ваксини за предотвратяване на тежка инфекция с COVID- 19.	yes	no	yes	no	no	no	no
557	"Един нов COVIDID-19 щам (B.1.526) е отстоен в Манхатън, в който се казва, че ""избягва част от защитата на антителата на антителата"" & appam; ваксините Ние не искаме нещата да се влошат, така че нещата да се влошат, така че да се носят маски над носа, да се пази физическото разстояние от ppl, AVOID GROUPS, и да се получи всяка ваксина, ако можете да https://t.co/ttftCb1VIK"	yes	no	yes	no	yes	no	no
558	Това е четвъртата ваксина, която трябва да се счита за безопасна и ефективна от здравните експерти на Канада - и с милиони дози, които вече са осигурени, ние сме една стъпка по-близо до унищожаването на този вирус.	yes	no	yes	no	no	no	no
559	Тези, които твърдят, че ваксините са 100% безопасни и които се смеят на анти-ваксерите, ще бъдат зависими от тези, които отказват да кажат на официалната лъжа, за да кажат, че широко разпространената ваксинация *е критична *. 23 умират в Норвегия след получаване на COVID-19 ваксина: https://t.co/eN10HwZvqW	yes	nan	yes	yes	yes	yes	yes
560	Ако всички тези доказателства не са налични, ние настояваме одобрението за употреба на генните ваксини да бъде оттеглено, докато всички посочени по-горе въпроси не бъдат надлежно разгледани от EMA https://t.co/lgznoGGGBc	no	nan	nan	nan	nan	no	yes
561	Добавяне, от понеделник, април 5, всички години 16+, които не са били допуснати до участие, ще бъдат допустими за получаване на ваксина. Това е новина, и аз призовавам всички кандидати да получат една от трите безопасни и ефективни СОВИД- 19.	yes	no	yes	no	no	no	no
562	В ЕС и Италия са били блокирани пратките от ваксина на AstraZeneca COVID-19, предназначени за Австралия, след като производителят на лекарството не е успял да достави дозовите дози, които е предписала Европа. https://t.co/GEMOlMwhkW	yes	no	yes	yes	no	no	no
