tweet_no	tweet_text	q1_label	q2_label	q3_label	q4_label	q5_label	q6_label	q7_label
1	За средностатистическия американец, най-добрият начин да се каже, ако имате гной, е да се изкашляте в лицето на богат човек и да изчакате резултатите от теста.	no	nan	nan	nan	nan	no	no
2	Това са просто глупости.	no	nan	nan	nan	nan	no	no
3	Може ли да следвате инструкциите на правителството, за да можем да изхвърлим тази кола и да бъде направена?! Чувствам се като детска градина, която продължава да губи повече време за почивка, защото едно или две деца не могат да следват посоката.	no	nan	nan	nan	nan	no	no
4	Не се обиждайте, но...	no	nan	nan	nan	nan	no	no
5	Това е лицето на човек, който е прекарал 9 часа в лични предпазни средства, които се движат в критично състояние.	yes	no	yes	no	yes	no	no
6	Вчера почуках на вратата и му казах, че може да остане в наемния имот безплатно за 5 месеца. Той е самонает с 4 деца. Не е нужно да ми казва какво е морално правилно. Хазяи, ако можете, направете повече, направете нещо.	yes	no	no	no	no	no	no
7	"Тези хора в бакалията, Dollar Jenners, тези работници за бързо хранене, служителите на ""Уолмарт"", тези хора, които дори не си мислил, че заслужават да имат заплата, за да оцелеят?"	no	nan	nan	nan	nan	no	no
8	Днес загуби собствената си битка с коронавируса, но даде живот и надежда на още много други.	yes	no	yes	no	no	no	no
9	факти и факти: нейната традиция за европейците да разпространяват потенциално фатално заболяване във всяка друга страна, която не е изцяло овладяна от бели хора.	yes	yes	yes	yes	no	yes	yes
10	Когато всичко свърши, трябва да си обещаем, че ще кажем на децата си, че сме оцелели от зомби апокалипсис през 2020 г.	no	nan	nan	nan	nan	no	no
11	Така че недостиг на въздух е корона симптом правилно, но знаете ли какво също ми дава недостиг на въздух? Безпокойство. И знаете ли какво ме притеснява?	no	nan	nan	nan	nan	no	yes
12	"""Младите хора не са изложени на риск, те ще имат само леки симптоми"" Грешно. Искам да отворя за трудностите, които преживях през последните дни, какво беше в ICU..."	yes	no	yes	no	yes	no	yes
13	Майка ми има докторска степен по Coronavir от Whats App University	yes	yes	no	no	no	no	no
14	Той е казал на богати приятели, но след това е осребрил нещо на стойност $ 1,4 млн. на борсата.	yes	nan	yes	yes	yes	yes	yes
15	Бъдете сигурни, че няма да ви хареса.	no	nan	nan	nan	nan	no	no
16	Корея завърши развиващите 10 минути Covid-19 диагностичен комплект и сега се развива до производство. Те планират да експортират 300.000 test-kits на седмица - URL	yes	no	yes	no	yes	no	yes
17	В момента има един голям слон в стаята, който не е единствената, която се случва в момента, и се случва в лошо, лошо време, в лошо, в лошо време, в лошо, в лошо време.	yes	no	yes	no	no	no	yes
18	Знаменитости продължават да се опитват да запеят вируса така. Това е филм на Дисни или нещо друго.	no	nan	nan	nan	nan	no	no
19	Може би ако имам	no	nan	nan	nan	nan	no	no
20	В момента обикаляме нашата фабрика, за да правим хирургически маски и други медицински облекла в кратки срокове. Ние можем да правим 2 милиона маски на ден, и се стремим да помогнем по всякакъв възможен начин през това време. #COVID19	yes	no	yes	no	yes	no	yes
21	"""Къщата ми"" ще пусне 6 викодин в четвъртък и ще го излекуват до събота сутринта."	no	nan	nan	nan	nan	no	no
22	Бях у дома, видях един приятел за последните 10 дни, пих бира за час извън кръчмата, от едната страна на масата, от другата страна на масата, от другата страна на масата, от другата страна на масата, от другата страна на масата, от другата страна на масата, от другата страна на масата, от другата страна на кръчмата, от другата страна на кръчмата, от другата страна на кръчмата, от другата страна на кръчмата, от другата страна на кръчмата, от другата страна на кръчмата, от другата страна на кръчмата, от другата страна на кръчмата, от другата страна на кръчмата, от другата страна на кръчмата.	yes	no	yes	no	no	no	no
23	Не разбирам как мекодоналдите могат да сервират по два милиарда хамбургера всяка година, но когато си поръчам пет милиона при шофирането, за да завладея системата,	no	nan	nan	nan	nan	no	no
24	Бро Китай е някъде тук и чете неграта нива на мощност и ние не можем дори да получите подходящи тестове	no	nan	nan	nan	nan	no	yes
25	Знам, че понякога съм хлъзгав, но задникът ми ще излезе навън.	no	nan	nan	nan	nan	no	no
26	Г-жо, съжалявам за живота без този коронов вирус.	no	nan	nan	nan	nan	no	no
27	"""Спрях го и му казах: ""Вижте, това не е филм. Вие не сте Will Smit in I Am Lang. Go hoom."" Това е актуализираната версия на италианските кметове, които губят от хората, нарушаващи #Covid19. Да, субтитрите са точни."	no	nan	nan	nan	nan	no	yes
28	И двете лекарства засягат QT интервала на сърцето ви и могат да доведат до аритмия и внезапна смърт, особено ако приемате други лекарства или имате сърдечно заболяване.	yes	no	yes	no	yes	no	yes
29	Ден 5: Ние сме преоткрити	no	nan	nan	nan	nan	no	no
30	Този Corona вирус ще мине през средата на април!!	yes	yes	yes	no	no	no	no
31	Много от вас попитаха какво е да си в спешното в момента. Искам да споделя малко с вас. Моля RT: A Day in the Life of a ER Doc - A Brief Disput from the #COVIDID19 Frontline:	no	nan	nan	nan	nan	no	no
32	Съществени стоки, лекарства и т.н. ще бъдат на разположение. Център и различни държавни правителства ще работят в тясна координация, за да гарантират това. Заедно, ние ще се борим COVID-19 и ще създадем по-голяма Индия. Джай Хинд!	yes	no	yes	no	yes	no	no
33	Кучета, когато разберат, че техните собственици не могат да напуснат заради короната	no	nan	nan	nan	nan	no	no
34	Не, никой не чисти като Гастон Карантините на Гастон като Гастон. Никой не спира да разпространява коли като Гастон.	yes	yes	no	no	no	no	no
35	Ето защо плажовете не са се затворили във Флорида и защо са имали минимална СОVID-19 превенция.	yes	no	yes	yes	yes	no	yes
36	"""Чувам те да правиш парти, ще изпратя полицията с огнемери."""	no	nan	nan	nan	nan	no	no
37	"В заключение, някои разумни съвети от медицинска сестра ""Това, което съм виждал много, са препоръки за това как да се опитаме да избегнем получаването на коронавирус на първо място -- добро пране на ръце, лична хигиена и социално дистанциране -- но това, което не съм виждал много съвети за..."	no	nan	nan	nan	nan	no	no
38	"""Корона"" не е реално, правителството иска да има в себе си две седмици, за да могат да сменят батериите на птиците."	yes	yes	no	no	no	no	no
39	6 ден от карантина: баща ми е разговарял с котките за	no	nan	nan	nan	nan	no	no
40	"Това е поколение Z. Искам да кажа, че защото хората обичат да звънят на всички 40 и под Millennials. Millennials не са в Spring Break. Millennials са в дома си крещейки на своите Boomer родители, които няма да седнат все още, защото те имат ""вяра над страх""."	yes	no	no	no	no	no	no
41	"""хей момчета, радвам се, че сте под карантина. Корона вирусът е истинско нещо."""	no	nan	nan	nan	nan	no	no
42	Ако не се разболееш, изборите, които правиш за това къде отиваш, могат да бъдат разликата между живот и смърт за някой друг.	yes	no	yes	no	no	no	yes
43	Този човек се нуждае от толкова много.	yes	no	no	no	no	no	no
44	Сега отмени тази закуска. Postpone, че кафе met-up. Rain проверка, че вечеря с приятели. Sucks не е тя?	no	nan	nan	nan	nan	yes	yes
45	Когато си вратар... и единствено дете... в самота... и се опитваш да се справиш с обучението си...	no	nan	nan	nan	nan	no	no
46	Може да е нещо голямо, но искам да ви напомня, че нашият Бог е Бог.	no	nan	nan	nan	nan	no	no
47	Предизвикателства в Инсталацията:- /	yes	yes	no	no	no	no	no
48	Сестрата на Кейти Портър, лекарят, се опитва да разбере как престоят в нея може да спаси животи по време на СОVID-19 криза	yes	no	yes	no	no	no	no
49	Някой друг да е крещял в гласа на Карди?	no	nan	nan	nan	nan	no	no
50	Тези работници се нуждаят от защита, здравеопазване и заплащане на обезщетения - независимо от статута на гражданството.	no	nan	nan	nan	nan	no	yes
51	Мен: з-майка ми с нейната докторска степен по корона вирус след като се дипломира от whatsapp резба: URL	no	nan	nan	nan	nan	no	no
52	Вижте BTS съобщението на надеждата да преодолее #COVID19, като се грижим един за друг! Ние каним Son Heung-min да продължи съобщението! Uld #SayConnected #ShiesStrong_ARMY #	no	nan	nan	nan	nan	no	no
53	Белите хора: СВОБОДНИ ЧОВЕЦИ: RONA Gay Peoples: Miss Rona	no	nan	nan	nan	nan	yes	no
54	Трябва ли да си тръгвате от май?	no	nan	nan	nan	nan	no	no
55	Тази сутрин... никога не съм виждал Вегас тази празна преди tbh #coronaviral	no	nan	nan	nan	nan	no	no
56	Имаше неприятен грип, който мина през декември / началото на януари. Казвам ти, това беше корона. Баре ppl бяха болни (включително мен) оплаквайки се от това, което сега знаем като симптомите на корона.	yes	nan	yes	yes	yes	no	yes
57	"И така, заради всичко, което се случи, си помислих: ""Защо не си направим един туитър?"" Така че, без повече приказки, каня всички ви в My twitter am! Можете да помолите някой да дойде с вас като приятел или като партньор. Балът ще се проведе на 25-ти март."	no	nan	nan	nan	nan	no	no
58	"Сега се занимавай с масите на ""Стандарт"" и ""Таймс"" е трудно."	no	nan	nan	nan	nan	no	no
59	От този до този адрес	no	nan	nan	nan	nan	no	no
60	Днес ние загубихме 2 колеги, един млад възрастен кардиологичен колега & amp; медицински онколог, дължащ се на COVID-19. Ние правим пауза, за да се молим за тях, И все пак тази война е, започва, без да има край в очите! Молим за вашите молитви Ние молим нашите политици да помогнат и агресивно да действат за подкрепа!	yes	no	yes	no	no	no	no
61	Китай има 24 пъти повече хора, отколкото Италия...	yes	no	no	no	no	no	no
62	След като всичко това приключи, не забравяйте в бъдеще интервюта за работа, за да ги попитате какво е направила тяхната компания, за да защити служителите си по отношение на глобалната ситуация COVID-19. Не може да се рискува да работи за своенравни компании.	no	nan	nan	nan	nan	no	no
63	Гуми от 15 до 15 години преди да се сдобият с корона	yes	yes	no	no	no	no	no
64	Прочетете отново: ITS ENTIRE ПРАВОМОЩИЯ.	yes	nan	yes	no	yes	no	no
65	Но кучката, която сте казвали -	no	nan	nan	nan	nan	no	no
66	Да, аз съм от Китай, но техническият термин е Covid-19 Майка ти произхожда от задната част на бук-шокларк, но я наричаме Джудит Не бъди лош.	yes	no	no	yes	no	no	no
67	Посочената в тази графа информация трябва да бъде включена в списъка в приложение I към Регламент (ЕО) No 1907/2006 на Европейския парламент и на Съвета от 18 декември 2008 г. относно защитата на лицата по отношение на обработката на лични данни от институции и органи на Общността и за свободното движение на такива данни (ОВ L 268, 18.8.2008 г., стр. 1).	yes	yes	no	no	no	no	no
68	Ядях това, което е чисто.	no	nan	nan	nan	nan	no	no
69	"Епидемиологът, който е помогнал за етеризирането на едрата шарка казва, че ранната работа на Тръмп с COVID-19 е ""е най-безотговорният акт на избран служител, който някога съм виждал през живота си""."	yes	no	yes	yes	no	no	yes
70	Това е полезно резюме на настоящото най-добро мислене сред експерти в областта на общественото здраве за това как трябва да подходим към борбата с COVID-19 през следващите седмици.	no	nan	nan	nan	nan	no	no
71	ЗЕЛЕНЧУЦИ, ПРЕСНИ или ЗАМРАЗЕНИ	yes	no	yes	no	no	no	no
72	Да, това се отнася и за двете страни.	no	nan	nan	nan	nan	no	no
73	Няма никакви свински думи.	yes	nan	yes	yes	yes	yes	yes
74	Знам какво става, но съм съгласен с тях, да се захващаме за работа, да си правим коли с малки задници, винаги да изглеждаме като паркинг, докато не се приближим.	no	nan	nan	nan	nan	no	no
75	Това е един поглед към това как лекар, който вече се е борил на фронтовата линия на една криза, го прави през един ден в тази. Добро напомняне за нас да им помогнем, като останем вкъщи.	no	nan	nan	nan	nan	no	no
76	Кълна се в себе си, ще се погрижа за теб и за теб.	no	nan	nan	nan	nan	no	no
77	Президент на Словакия, появяваща се в короната си капков, ръка-защита съвпадение на тъканите хирургически маски и костюми...	yes	no	no	no	no	no	no
78	"Този епизод на ""Black Mister"" е много дълъг."	no	nan	nan	nan	nan	no	no
79	Това е за теб, дебело, дебело, дебело, дебело, дебело, дебело, дебело, дебело, дебело, дебело, дебело, дебело, дебело, дебело, дебело, дебело, дебел задник, кучка. Идвам там и ще те пребия от бой, кучко.	no	nan	nan	nan	nan	no	no
80	Брато, това са единствените 3 песни, които чувам на моя TL-борд, вземи тази корона веднага!	no	nan	nan	nan	nan	no	no
81	Не всички герои носят пелерини, понякога те обличат одеало, а след това etflix chill в продължение на 2 седмици	no	nan	nan	nan	nan	no	no
82	си там винаги удобните места хитове 3G	no	nan	nan	nan	nan	no	no
83	След като разберете, че е заразена с Harvey weinstein	no	nan	nan	nan	nan	no	no
84	Има общо 35 вентилационни агрегати, 10k, които трябва да бъдат направени от govt. Тя е превърнала в нова болница 1k легло в Берлин. Смъртната й честота е малка, bcos масовото й изследване позволява карантина, а bcos има по-малко докладвани случаи.	yes	no	yes	no	yes	no	yes
85	Лица, след като са били поставени под карантина:	no	nan	nan	nan	nan	no	no
86	"Предотвратяване: Дете на възраст над 18 години е починало от коронавирус в Лос Анджелис, представители на общественото здраве обявяват, в това, което се смята, че е първата смърт на дете от вируса в САЩ. ""Опустошително напомняне, че COVID-19 заразява хора от всички възрасти"", казва здравният служител на ЛА."	yes	no	yes	no	yes	no	yes
87	Обръщане към нацията в борбата срещу заплахата от насилие. #IndiaFightsCorona	no	nan	nan	nan	nan	no	no
88	Всички мръсотии донесоха короната у дома от Маями &amp; сега тя се увеличава с 88% в 48HRS....	yes	yes	yes	yes	yes	yes	yes
89	Всеки, който излиза от короната като бариста	no	nan	nan	nan	nan	no	no
90	"""Ако зависеше от лекарите, щяха да затворят целия свят."" Всъщност, ако зависеше от нас, щяхме да спасим колкото се може повече хора."	yes	no	no	yes	yes	no	yes
91	Един от моите колеги почина днес от #COVISID19. Не много по-възрастен, добър човек.Ние бяхме заедно преди няколко седмици, говорейки за каквото и да е.Следващия път,когато го видях,той беше приет в интензивното.И това беше последният път,когато го видях.Цялото ми тяло се чувства изтръпна.	yes	no	no	no	no	no	no
92	"Ако ми беше казал в ""Нови години"", че в рамките на 3 месеца от 2020 г.: -Кобе Брайънт е мъртъв -Ще бъдем под карантина от COVID-19 -Училищата и спорта са затворени -Том Брейди е Тампа Бей Буканеър, щях легитимно да си помисля, че светът е към края си."	yes	no	no	no	no	no	no
93	Ако това е за тяхно добро, дай им сила да минат през него.	no	nan	nan	nan	nan	no	no
94	Един ден, ако той иска, и когато всичко това свърши, бих искал да се упражнявам с него като цел! Какво мислиш?	no	nan	nan	nan	nan	no	no
95	Има силно и разбираемо желание да се върнеш към по-добро и функционираща икономика, но това не трябва да се губи за никого, че няма такова нещо като функционираща икономика и общество, стига да продължи да се разпространява в най-големите ни градове.	no	nan	nan	nan	nan	no	no
96	Изоставена двупартийна работа по законопроекта COVID-19, след което се опита да премине безскрупулен корпоративен спасителен план, който не помогна достатъчно на здравните работници, на първите отговорили и на семействата от работническата класа. Фокусирай се върху ХОРА, ЗАЩИТНИ НЕ Wall Street.	yes	nan	yes	yes	yes	no	yes
97	Този човек се страхуваше, че ще зарази семейството си и си мислеше, че няма да получи лечение, защото те са бедни, така че той просто си е отнел живота.	no	nan	nan	nan	nan	yes	yes
98	Това е майка ми, тя е моят герой. Тя е 60-годишен лекар, лекуващ пациенти за #COVID19. Тя поставя здравето си в опасност, за да тества пациентите, да им даде необходимите грижи и да направи каквото може, за да предотврати разпространението на общността и обезщетяването на нашите болници.	yes	no	no	no	no	no	no
99	Преди един месец Италия откри първия си случай на #coronavirus. Ще ви кажа какво се случи само за един месец. Надявам се, че можете да се поучите от нашите грешки.	yes	no	yes	no	no	no	no
100	Това е режисьорът на RITM д-р Сил Карлос, който е бил несправедливо отстранен от позицията си, защото е отказала да приоритизира обработката на COVID-19 на тестове на катодми и други VIP-и над пациенти със симптоми.	yes	no	yes	yes	yes	no	yes
