tweet_no	tweet_text	q1_label	q2_label	q3_label	q4_label	q5_label	q6_label	q7_label
180	Съобщете на лекаря си, че е починал от амбулаторен амбулаторен амбулаторен амбулаторен амбулаторен амбулаторен синдром.	yes	no	yes	no	no	no	no
181	Биар: 38-годишният мъж, който е починал на AIIMS в Патна и е показал положителен резултат за #COVID19, има чуждестранна история на пътуване до Катар.	yes	no	yes	no	no	no	no
182	#Qatar отказа да подготви болница за хилядите #CoronaVirus заразени работници на нейната земя, вместо това, тя ги е заключила вътре в приюти за животни без никаква медицинска помощ! Мигрантите работници не са роби, те имат права! Засрами се #Човешки орги, че мълчат!	yes	yes	yes	yes	yes	yes	yes
183	НОВИНИ: #COVIDIN в Румъния, Катара, Сингапур, Саудитска Арабия, Филипини, Еквадор, Южна Африка, Индонезия и Индия. Избягвайте всички несъществени пътувания в тези области.	yes	no	yes	no	no	no	yes
184	Получава се, отива в болница, се намира в болница, споменат в AIIMS, но умира. Doc установено, че той е Corona+ полицията достига до дома, поставя цялото семейство в карантина. Сега Every член е избягал от дома &	yes	no	yes	no	yes	yes	yes
185	38-годишен Saif Ali починал снощи в AIIMS, Патна. Върнал се е от преди няколко дни.	yes	no	yes	no	no	no	no
186	AIIMS Patna, дължащо се на #Coronavirus.Той се върна от Катар и беше приет в болница на 20 март 20. #CoronaVirrusUpdate URL	yes	no	yes	no	no	no	no
187	В съответствие с член 21 от Финансовия регламент всички приходи, записани в позиция 6 0 3 3 3 от приходната част на бюджета, могат да доведат до отпускане на допълнителни бюджетни кредити в съответствие с член 21, параграф 2, букви д) и е) от Финансовия регламент.	yes	no	yes	no	no	no	no
188	Това са дезинфекцираните в мизерни условия..това е нечовешко..	yes	no	yes	yes	yes	yes	yes
189	"Амнестията казва, че е против да се подготви болница за работници, заразени с #коронавирус, работещи върху проекти като Борба с амнистии Амнестизи, от които има много случаи вътре в ""работните лагери"", където работниците са живи. Аз предупредих за това преди няколко дни. #coronavirus PROTECID има кръв по ръцете"	yes	nan	yes	yes	yes	yes	yes
190	Те не ме попитаха къде в Италия съм отишъл или дали съм влязъл в контакт с болни хора. Те не ме попитаха нищо.	yes	no	yes	yes	yes	yes	yes
191	Ако имате някакви пари у дома, сложите някои ръкавици, вложите всички пари в найлонова торба и ги сложите пред входната врата тази вечер. Събирам всички найлонови торбички тази вечер за безопасност.	yes	no	yes	no	no	no	no
192	ТЕХНОЛОГИИ, КОИТО ТРЯБВА ДА СЪДЪРЖАТ БЮДЖЕТНИТЕ ДАННИ, КОИТО ТРЯБВА ДА СЪДЪРЖАТ БЮДЖЕТНИТЕ ТЕХНИЧЕСКИ ДАННИ, КОИТО ТРЯБВА ДА СЪДЪРЖАТ БЮДЖЕТНАТА ТЕХНИЧЕСКА ТЕХНИЧЕСКА ТЕХНИЧЕСКА ТЕХНОЛОГИЧЕСКА ТЕХНОЛОГИЧЕСКА ТЕХНОЛОГИЧЕСКА ТЕХНОЛОГИЧЕСКА ТЕХНОЛОГИЯ	no	nan	nan	nan	nan	no	no
193	ДАЛИ НЯКОИ НЕДОСТАТЪЧНИ ИЗПЪЛНИТЕЛЕНИ НЕЗАВИСИМОСТЪПНИ ИЗПЪЛНИТЕЛНИ ИЗПИТВАНИЯ	yes	no	yes	no	yes	yes	yes
194	.@NationalNexs Председателят на Комисията Денонощно чете публично изявление от един от нашите карантинни #ners, който работи в Northern California Kaiser съоръжение.Пълен преглед #COVIDM URL	no	nan	nan	nan	nan	no	no
195	Човек в Инхеон, западно от Сеул - който се е заразил с #coronavirus - е документирал своите симптоми и дейности за последните 25 дни, откакто е усетил симптомите в 38 страници в забележителен детайл. Носел е маски и у дома и всичките 23 близки контакта са били отрицателни за вируса.	yes	no	yes	no	yes	no	yes
196	И така, вирусът на CORONA ви спира да ядете китайска храна.	no	nan	nan	nan	nan	no	no
197	Има още една работа, която трябва да свършиш.	no	nan	nan	nan	nan	no	no
198	Ако имате някакви албуми в дома си, поставете някои ръкавици, поставете всички албуми в кутия и ги поставете извън предната врата през тази врата. Събирам всички кутийки тази вечер за безопасност. Мислете за вашето здраве.	yes	no	yes	no	no	no	no
199	Колко теста на много хора биха могли да бъдат покрити от цената на построяването на...тенис павилион в Белия дом?	no	nan	nan	nan	nan	no	yes
200	"Това е смъртоносно сериозно: като говорим за корона-вирус тази сутрин, Тръмп каза: ""Затворихме го, спряхме го, спряхме го."" Имаше 15 потвърдени случая в САЩ преди седмица. Има 233 днес. Ще има *5,000* за седмица TRUMP'S INCOMPPETCE ISES. URL"	yes	no	yes	yes	no	no	yes
201	За да се спре разпространението на #cocoronvirus: да се тества за това, така че да можем да го съдържат.	yes	no	yes	yes	yes	no	yes
202	Това означава, че сега е петък. Това означава, че SMOID лъже, отново. УПОТРЕБАта не е спряла #CoronavirusOutOutbreak. Тя вече е пораснала &amp; разпространение до 21 държави с над 225 случая в САЩ. И ние не можем да го съдържат, защото ние все още нямаме достатъчно комплекти за тестове, за да се знае къде е вирусът.	yes	no	yes	yes	yes	no	yes
203	Метамфетаминът, с когото си се объркал през 2014 г. е бил вирусът Corona	yes	yes	no	no	no	no	no
204	"Хайде да сложим """""""" в чата за дядо."	no	nan	nan	nan	nan	no	no
205	Той знаеше за вируса през януари, вместо да е водещ, ПОТРЕБИТЕЛЕ бълва фалшива информация за #COVID” за да омаловажи нарастващото огнище. Напълно неприемливо.	yes	no	yes	yes	yes	no	yes
206	Това не е като Рик, не е като Рик. Това трябва да бъде като Рик. Това трябва да отиде вирус.	yes	no	yes	yes	no	yes	yes
207	"""Най-добрите оценки в момента за общата смъртност при COVID- е някъде между 1% и 1%,"" Adm. Bret Giroir, помощник-секретар за здравето в HHS, казва. ""Това е по-ниско от това, което сте чували вероятно в много доклади... това не е вероятно в диапазона от 2 до 3%"""	yes	no	yes	no	no	no	yes
208	Няма нито един потвърден случай на азиатски заразен в NYC в NYC.	yes	yes	yes	no	no	no	no
209	Панирната покупка е симптом на едно нефункционално общество, заразено с индивидуализъм За тези с лити сапун у дома- осъзнаваш ли, че за да се забави предаването на COVID-19 се нуждаеш от други хора, които също да си почистват ръцете?!	yes	no	yes	yes	no	yes	no
210	В момента, в който бъде чут, че #Coronavirus е проблем в Китай, той изключва влизане в Съединените щати от Китай. Това спаси много животи! #TrumpTonavirus е проблем в Китай той изключва влизане в Съединените щати от Китай. Това спаси много животи! #TrumpTonHall URL	yes	no	yes	no	yes	no	yes
211	Ще трябва да отида в ТолСпритСприт.	no	nan	nan	nan	nan	no	no
212	"Епидемиолог Marc Lipsitch, директор на Харвардския център за комуникативни заболявания Динамика: ""В САЩ това е точно обратното на това, което се съдържа. """	yes	no	yes	yes	no	yes	yes
213	ЛИЧНИ ИЗявления ОТ Himham Hamdan, Covid-19 @ Case 26. Read this. Eye-Opening. URL	no	nan	nan	nan	nan	no	no
214	Има и друг случай на #COVID19 при пътешественик, който е придобил инфекцията в...Лас Вегас. Чул си това право - Лас Вегас. САЩ е износител случаи и историята на пътуването става все по-бързо.	yes	no	yes	yes	yes	yes	yes
215	ПРЕКРАТЯВАНЕ: Вече има повече от 100 000коронавирусни случаи по целия свят. 3,398 души са починали от #COVID19 и 55,672 души са се възстановили.	yes	no	yes	no	no	yes	yes
216	Реших да прочета почти всяка книга, която съществува на #CoronaVirrus днес. Моят фон е биология и неврология и аз съм обсебен от улова parabol тенденции рано, данни и медицински изследвания. Тук е нишка с най-новите изследвания Чувствайте се свободни да retweet или с кредити	no	nan	nan	nan	nan	no	no
217	Бих искал отново да изразя близостта си с тези, които са болни с #caronavirus и със здравните работници, които се грижат за тях, както и с гражданските органи и всички онези, които участват в подпомагането на пациентите и в разпространението на вируса.	no	nan	nan	nan	nan	no	no
218	"И все пак, ако това бяха Хари и Меган, които се шегуват с това, щеше да е ""Мегън желае смърт на невинните граждани на Великобритания"""	no	nan	nan	nan	nan	no	yes
219	: Тръмп все още може да има собствен капитал в компания, която, според CDC, ще играе основна роля в предоставянето на картинни тестови комплекти на федералното правителство, което означава, че Тръмп може да се възползва от коронавирусното тестване. #COVIDId)19 #coronavirus	yes	yes	yes	yes	yes	no	yes
220	Coronavirus COVID-19	no	nan	nan	nan	nan	no	yes
221	Знаете ли, че в момента има 96 950 случая на убийство? Знаете ли всички, че 3008 души са умрели от това? Но знаете ли, че 53,981 от тези случаи вече са се възстановили? Спрете да позволявате на медиите да контролират мозъка ви. Плашещите тактики са истински тактики.	yes	no	yes	yes	no	no	no
222	Имате ли план? Също така, кога местните юрисдикции ще получат комплектите за тестове #Coronavirus, които обещахте?	no	nan	nan	nan	nan	no	yes
223	Всеки път, когато чуе някой да киха или да кашля, той ги моли да се върнат веднага, или да работят от дома си. Нещото за нас азиатците е, че винаги мислим, че RAJINNYA DTG KERJA WALAUPUN SAKIT S.A.S.Y.T. за нас азиатците е, ние винаги мислим, че RAJINNYA DTG KERJIA WALA WALAUPUPUN S.A. S.A. S.D. D.D.Y.Y.Y.T.	yes	no	no	yes	no	no	no
224	Същите хора, използвани в няколко снимки за Corona вземания в различни градове по целия свят &gt;&gt;33 е преобладаващ брой очевидно.	yes	no	no	yes	yes	yes	no
225	След седмици на Федералното правителство да си протегне краката върху COVID-19 тестването, Тръмп, който току-що призна пред камерите, че иска да манипулира измерването на епидемията в негова лична политическа полза.	yes	no	yes	yes	yes	no	yes
226	Аз ще замина за Франция за ски + може да хвана корона вирус, така че аз ще бъда най-вече AFK. За да празнувам, че ще дам този прохладен Nomad нож далеч. Просто retweet да влезе. Избиране на случаен победител, когато съм у дома!? &lt;3 Us	yes	no	no	no	no	no	no
227	Корея: даващ безплатен тест за примамки за животни от рода на едрия рогат добитък (PH): ние на тикток!!!	yes	yes	yes	no	yes	no	yes
228	--------------------------------------------------------------------------------------------------------------------------------------------------------------------------------------------------------------------	yes	no	yes	no	no	no	yes
229	Аз си измия ръцете:	no	nan	nan	nan	nan	no	no
230	Ще ни дадеш ли поне 30 подаръка?	no	nan	nan	nan	nan	no	no
231	Човек в Дортмут със симптоми на #COVIDY19 беше помолен да се постави под карантина, докато чакаше резултатите от тестовете. Той реши, че е добре и отиде на парти. Резултати се върнаха положителни на следващия ден. Сега друг го има. Защо толкова много се отнасят към това като към шега?	yes	no	yes	yes	yes	yes	yes
232	Какво работи в спирането на разпространението на Коронавирус: 1. Измийте ръцете си за най-малко 20 секунди 2. Кашляйте и кихнете в лакътя 3. Останете вкъщи ако сте болни Какво не работи:.	yes	yes	yes	no	no	no	no
233	Докосването на лицето на човек не се препоръчва, тъй като #Conononavirus се разпространява широко по целия свят. Докосването на лицето на друг е просто неприемливо	yes	no	no	no	no	no	no
234	Ето го и моето съобщение за обществена услуга: Ако STORID казва или туитира нещо в противоречие с това, което лекарите и експертите са казали за #CoronavirusOutOutbreak, доверете се на лекарите и експертите. Вашият живот и този на вашето семейство и приятели може да са в опасност.	no	nan	nan	nan	nan	no	yes
235	Най-страшното нещо за COVIDID-19 е, че изглежда като JIRA билет	no	nan	nan	nan	nan	no	no
236	СЗО се консултира с Виетнам, за да получи помощ за световната криза. Разбира се, че това не е в нашите новини. Разбира се, че това не е в нашите новини.	yes	yes	yes	no	yes	no	yes
237	Трябва да ти кажа, че трябва да ти кажа, че това е най-неотносното нещо, което може да ти е отнело.	yes	yes	yes	yes	yes	yes	yes
238	НА 60 години жените настинаха и се разколебаха.	yes	yes	yes	yes	no	no	no
239	Това е harda time URL	no	nan	nan	nan	nan	no	no
240	Не умирай от Коронавирус без да видиш това първо, това е най-добрият клип, който ще гледаш тази година.	no	nan	nan	nan	nan	no	no
241	Това, което е особено срамно, е да се използват изкуствено дефифицираните номера, поради липсата на изследвания, за да се каже, че вирусът е бил спрян.	yes	no	yes	yes	yes	yes	yes
242	Ако имах корона, нямаше да съм толкова зле. Ще имам много време да наваксам, да чета, да пиша, да пиша и ако имам късмет, да умра.	no	nan	nan	nan	nan	no	no
243	Това е най-добрият набор от информация, който открих на корона вирус и си струва да се гледа на всички 10mins URL	no	nan	nan	nan	nan	no	no
244	Нормални болни пациенти в сравнение с пациенти с Corona virus #Corona VirusCharse	no	nan	nan	nan	nan	no	no
245	Вирусът на омразата е по-смъртоносен от вируса на Корона!	no	nan	nan	nan	nan	no	no
246	Според ПОТРЕБИТЕЛЯ има повече от 2 случая &amp; 14 смъртни случая, включително 56 нови случая днес. Поради липсата на тестване от Администрация, ние все още не знаем степента на разпространение на вируса.	yes	no	yes	yes	yes	yes	yes
247	House music is away. House music is very #	no	nan	nan	nan	nan	no	no
248	За да се помогне на Вашите номера на одобрението, трябва да се има предвид опит за убийство.	no	nan	nan	nan	nan	yes	yes
249	Coronovirus #COVISID19 се отменя!	no	nan	nan	nan	nan	no	no
250	Всички вие туитвате за короната, но не и за корините.	no	nan	nan	nan	nan	no	no
251	Целият свят: Corona Вирусът е опасен.	no	nan	nan	nan	nan	no	no
252	"""Това е ковчегът там, както можете да видите"""	no	nan	nan	nan	nan	no	no
253	Този враг на всички нас изисква глобално усилие за борба, ръководена от науката, а не от магическо мислене.	yes	no	yes	no	no	no	no
254	В петък се появяваш с откачалка, пълна със сок от Корона и маска за дишане...	no	nan	nan	nan	nan	no	no
255	Обиколната зона около Свещеното кааба на Свещената джамия в Мека е била изпразнена от хора временно, за да се почисти и стерилизира, поради страховете на Коронавируса и за да се осигури безопасността на поклонниците.	yes	no	yes	no	no	no	no
256	НАУЧНИ мерки срещу СОВИД-19 в този видеоклип от TikTok! Присъединете се към предизвикателството! Следвайте официалния профил на тайкток в ID:dohgovphph?	no	nan	nan	nan	nan	no	no
257	"""Какво нелепо и невъзпитано...това е спешен случай в областта на общественото здраве."""	yes	no	yes	yes	no	yes	yes
258	Нека да донесем повече надежда! Науката работи!	no	nan	nan	nan	nan	no	no
259	От 6 март 3PM KST, #BTSARMY дари приблизително 505,5000000 спечелени за COVID-19 за 9 дни!!!	yes	no	no	no	yes	no	no
260	Те казват, че ние сме култ, когато в действителност ние сме семейство.	no	nan	nan	nan	nan	no	no
261	Category (включително и аз) appeared the #CoronavirusOutOutpreak, Pence now now resides there are not there are noough #coronavirus test kits. Experts (включително аз) appeared the going for weeks and recalled for point-of-care #COVID19 tests. Тяхната некомпетентност ще отнеме животи.	yes	no	yes	yes	yes	yes	yes
262	#HongKoong реши да не се вслушва в собственото си правителство поради основателни причини и реши да носи маски, за да се защити. #HongKong имаше първия случай на #coronavirus далеч по-рано от повечето от страните в този списък и е виждал почти нищо, за да не се увеличи в случаите, тъй като.	yes	nan	yes	no	yes	no	yes
263	Така че има трансмисия, измий си ръцете, моля те, не кашляй и не се занимавай с хора.	no	nan	nan	nan	nan	no	no
264	Керала е единствената държава в Индия, която успешно спря 3 смъртоносни вируса, Corona, Nipah и BJP.	yes	yes	yes	no	yes	no	no
265	Най-малко 1 пациент, който е оцелял по-късно, е получил белодробна трансплантация поради трайна фиброза (болест) на белите си дробове.	yes	no	yes	no	yes	yes	yes
266	Моят любим няма да е съвършен, ако не го направя сам.	no	nan	nan	nan	nan	no	no
267	"Парите за правителството на САЩ се управляват от конкретен офис в Министерството на финансите на САЩ; Вие не изпращате чек на ""Офисът на Помощния секретар за здравето"" - вижте"	yes	no	no	yes	no	no	yes
268	И така, ето един въпрос за днес: ако сте лекар в района на Сиатъл, можете ли, считано от днес, да поръчате тест COVID-19 за всеки пациент, който смятате, че трябва да бъде изпитан?	no	nan	nan	nan	nan	no	yes
269	Какъв е най-добрият начин, по който можем да кажем, че 16 души са били тествани?	no	nan	nan	nan	nan	no	no
270	Този пакет от спешни действия дава на нашето правителство ресурсите, от които се нуждае, за да се справи с тази социална здравна криза, без да краде и цент от други критични инициативи, с моя подпис отива на бюрото на президента.	yes	no	yes	no	yes	no	no
271	Не позволявайте да се раздвоявате и разрушавате живота си и този на нацията. - Sg #ConononaVirus	no	nan	nan	nan	nan	no	no
