tweet_no	tweet_text	q1_label	q2_label	q3_label	q4_label	q5_label	q6_label	q7_label
709	Най-много хора са склонни да приемат COVIDY ------------------------------------------------------------------------------------------------------------------------------------------------------------------------------------------------------------------------------------------------------------------------------------------------------------------------------------------------------------------------------------------------------------------------------------------------------------------------------------------------------------------	yes	no	yes	no	no	no	no
710	За сравнение, има над 200 COVID- 19 в клинични проучвания в един и същи момент.	yes	no	yes	nan	yes	no	yes
711	Ето още: https://t.co/lohw1h0pKE. https://t.co/AokdaUWWG6J	yes	no	yes	no	no	no	no
712	Дръжте тук, за да получите информация от здравните агенции и длъжностните лица относно:	yes	no	yes	no	no	no	no
713	Днес се провеждат и първите ваксинации от Оксфорд/Астраценека, които помагат за защита на уязвимите хора от COVID-19. Обединеното кралство е обещало £548m към COVAX, което се опитва да достави ваксини на 92 страни с ниски и ниски и ниски средни доходи. https://t.co/W0rKgCyLZB	yes	no	yes	no	no	no	no
714	Беше преди година, но ОАЕ продължава да играе положителна роля в международен план чрез приноса си на хуманитарната и медицинската помощ към тези, които са в нужда, в допълнение към оказването на помощ за разпространението на ваксини по целия свят https://t.co/1iQ0QXNyH	no	nan	nan	nan	nan	no	no
715	Новите данни от мащабно проучване при пациенти в старческа възраст U.K. възрастни предоставиха допълнителни доказателства, че ваксините Pfizer и FerZeneca са силно ефективни срещу Covid-19, след като една доза https:://t.co/frbBBo6tGEC	yes	no	yes	no	no	no	no
716	Тези ваксини са безопасни и ефективни и са начина, по който ще преминем през тази пандемия. Когато сте подходящи, вземете ваксината си и направете вашата част, за да победите COVID-19. #lagod https://t.co/JRJ1tj9AyQ	yes	no	yes	no	no	no	no
717	SBS публикува днес видеоклипове на повече от 60 езика, включително AUSLAN, като предоставя информация за плана на Австралия COVID-19 за извършване на ваксинацията, как работят ваксините и как са одобрени те в Австралия. #VaccineAustralia #COVID19 https://t.co/8fRsVxs1ND https://t.co/Wf8cwZUdpn	yes	no	yes	no	no	no	no
718	"Ново партньорство с ваксината, договорено между Съединените щати, Япония, Индия и Австралия, планира да наводни азиатските и Тихоокеанските островни страни с ""най- малко"" 1 bill Ваксини, приемани от Google https://t.co/dqDsnRs9M9"	yes	no	yes	no	no	no	no
719	Съветът прие Решение (ОВППС) 2015/1333 [2] за назначаване на членовете и заместник-членовете на Комитета на регионите за периода от 26 януари 2015 г. до 25 януари 2020 г.	no	nan	nan	nan	nan	no	no
720	Провизиите се извършват по три начина -- безвъзмездни средства, търговски продажби от страна на производителите и чрез ваксиния алианс на GAVI COVAX съоръжението на GAVI: https://t.co/WRq7B7enzP	yes	no	yes	no	no	no	no
721	Ние се съгласяваме с @SenBaker: За да се сложи край на пандемията, Biden трябва да предприеме стъпки за предприемане на стъпки за засилване на глобалния достъп до ваксината. https://t.t.co/ZJGG3zipiddc	yes	no	yes	no	no	yes	yes
722	Ние се присъединихме към повече от 100 организации за граждански права, като одобрихме писмо, в което се отправя призива за разпространяване на ваксините.	yes	no	yes	no	no	no	no
723	Проучването ми за това какво ни казва за МПА-то, което е изтекло от ЕМА-то от материала, който е изтекло от ЕМА, относно МГТ и ваксините „Covid-19“. История за непрозрачността и неотложната необходимост на научната общност да бъде предоставена достъп до пълни данни: https://t.co/NTBYwewehwIIx	no	nan	nan	nan	nan	yes	yes
724	Бележка: „ COVID- 19 ваксините са много безопасни с висока ефикасност, особено при предотвратяване на тежка болест, хоспитализация и смърт“ ~ Д- р Phionah Atudebwe #COVIDVISVUC	yes	no	yes	no	no	no	no
725	Аз имам, моята, моята майка имаше нейната, и когато е твой ред, аз те призовавам да си вземеш твоята също.	yes	no	yes	no	no	no	no
726	Повече ресурси тук: https://s://t.co/J8DxqqKhKhKhF9x https://t.co/Fu8wTWip8b	no	nan	nan	nan	nan	no	no
727	Председателят Biden, под интензивния натиск да дари на нуждаещите се страни антикорупционни ваксини, се придвижи да се справи с глобалния недостиг по друг начин - като си партнира с Япония, Индия и Австралия, за да разшири глобалния производствен капацитет на ваксината https://t.co/nyDxDEde8A	yes	no	yes	no	no	no	no
728	"""Макар че е достатъчно"": Бостън училище автобусни шофьори атракт, призовава за COVID-19 ваксини и тестване на автогарата https://t.co/SqUnl9ctTexh чрез @BostonGlobe"	no	nan	nan	nan	nan	no	no
729	И трите ваксини са силно ефективни в предотвратяването на хоспитализацията и смъртта поради COVID... Разликите в съобщената ефикасност на ваксината са незначителни в сравнение с големите ползи.	yes	no	yes	no	no	no	no
730	Тези програми ще извървят дълъг път, за да помогнат за затварянето на пропастта и да получат повече ваксини в оръжията. https://t.co/pBmM9wXOkb	yes	no	yes	no	no	no	no
731	Това е мястото, където отиваме за съвет и подкрепа. Ние изслушахме някои от тези чатове, за да чуем директно от семействата техните преживявания, мисли и чувства на Covid-19. https://ts://t.co/OfSsu70C5p	no	nan	nan	nan	nan	no	no
732	".@asalavitmith46 относно актуализирането на ваксините срещу ковидуални варианти: ""Всяка от компаниите -- както одобрените, така и кандидатите -- имат намерение да продължат да актуализират своите ваксини, и ако е необходимо, да създадат бустери."" https://t.co/ObL0ozdDMH https://t.co/XRTCvLq"	no	nan	nan	nan	nan	no	no
733	За да намалят броя на смъртните случаи, длъжностните лица използват CD-препоръчителна формула за разпространяване на ваксини в групи от групи. https://t.co/OhMCW3Fwhd	yes	no	yes	no	no	no	no
734	Изстрелът на Pfizer е причина за смъртност сто пъти повече при младите хора в сравнение със смъртността от коронавирус без ваксината, а десетки повече при хората в напреднала възраст... https://healthimpactnewsDOTcom/2021/date- rights- skyrocket-in-israel- последващ-pfizer-experialmental-covid-vacciens/	yes	yes	yes	yes	yes	yes	yes
735	Изследователите казват, че това е вероятно поради комбинация от фактори, включително хормони, гени и дозиране на изстрелите. https://t.co/ZqAskWgJVB	yes	no	yes	no	no	no	no
736	Имаме още един инструмент в нашия арсенал, за да върнем Онтарио обратно на пътя към възстановяването, възстановяването и възстановяването, нормата. Ние сме фокусирани с лазер, за да можем да се въоръжим възможно най-бързо. https://t.co/YE95kEBD	yes	no	yes	no	no	no	no
737	Добрата новина е, че 7-дневната прилагана средна стойност на прилаганите ваксини в САЩ е надвишила 2 милиона за първи път и само се увеличава. https://t.co/bWKDHsluCY: https://ts://t.co/Yf7bx7nw	yes	no	yes	no	no	no	no
738	Как: https://t.co/RN8hcs88pO https://t.co/KaxtttV7O0J	yes	no	yes	no	no	no	no
739	САЩ, най-богатата нация в света, с най-високия брой на смъртните случаи в рамките на „Covid-19“ - сега над половин милион - трябва да бъдат водещи в борбата за споделяне на животоспасяващи ваксини и лечение по целия свят.	yes	no	yes	no	no	no	no
740	Ваксините Pfizer и Moderna COVID- 19 са безопасни за бременни жени на базата на данни от програмите за наблюдение на CDC. https://t.co/Wcit FoppkMv	yes	no	yes	no	no	no	no
741	Тази схема има за цел да предостави най-малко 2 милиарда дози на страни с по-ниски доходи https://ts://t.co/HiwwwwwwwwzWGMdK	yes	no	yes	no	no	no	no
742	За актуализирана информация относно начина на установяване на приоритетните групи и къде да се получи достъп до ваксината #COVID19, посетете https://t.co/g4IbPPSzQN #ocoronavirus #COVID19vacaccines https://t.co/oKm6oC8a	yes	no	yes	no	no	no	no
743	Няма нужда от повече информация, за да се гарантира, че информацията, която трябва да се предоставя, е достъпна за всички.	yes	no	yes	no	no	no	no
744	Благодаря ти @POTUS, @GovWhitchitm &amp; всички усърдно работещи медицински сестри &amp; подкрепа на хората, които правят това да се случи! #wtpBL #Fresh https://t.co/a8j1f0f0f1mV	no	nan	nan	nan	nan	no	no
745	Няма причина Китай да не трябва да се притеснява за Quad (US, Индия, Япония, Aus), когато говори за изменението на климата, ваксини. САЩ, Индия комбинирано отчитане за над 1/3 от глобалните случаи и повече от 1/4 от смъртните случаи в световен мащаб от Covid-19. Много да се говори за и повече, за да работят.	yes	nan	yes	yes	no	no	yes
746	(B.1.351 lineage), и Бразилия (P.1 lineage). https://t.co/QrBBPEIgPEA #COVID https://t.co/Z1RFDLLG	yes	no	yes	no	no	no	no
747	Благодаря на правителството на Индия за дарението на дозите от AstraZenecaca. Ваксините пристигнаха днес следобед и са тласък на нашата ваксинация, която ще започне на 10 март 2021 г. https://t.t.co/a/ka/ka3lcWGG6TW	yes	no	yes	no	no	no	no
748	Производителите трябва да открият важна информация за това как действа ваксината COVID, възможно е да е възможно да се установи, че значима информация, която може да се използва за предсказване на очевидния потенциален краткосрочен и дългосрочен риск от ваксините COVID-19, се прикрива. https://t.co/9MzHogqpZM	no	nan	nan	nan	nan	yes	yes
749	Pfizer и BioNTech ще надвишат своята първоначална глобална цел за COVID- 19 ваксини с до 20 % през тази година, Pfizer Chief Executive Albert Bourla каза: __________________________________________________________________________________________________________________________________________________________________________________________________	yes	no	yes	no	no	no	no
750	Това се дължи на факта, че ваксините действат като средство за предизвикване на отговор в имунната система на човека.	yes	no	yes	no	no	no	no
751	В петък, тези ваксини ще влязат в ръцете на хората, които са се намесили и са създали ваксина за рекордно кратко време, благодаря ви. Борбата с COVID е екип усилие. https://t.co/JM0gTZX8N6	yes	no	yes	no	no	no	no
752	Когато пациентите ми ме попитат коя ваксина да приемат, на доверие, че ще им кажа да вземат някоя от трите ваксини, които могат да получат.	yes	no	yes	no	no	no	no
753	Няма проблем да имате въпроси относно ваксините COVID-...да получите отговорите на https://t.co/aoM1GnuEs1 и да продължим да бъдем заедно! @Ad	no	nan	nan	nan	nan	no	no
754	Ваксините действат, като обучават имунната Ви система как да се защити срещу атака от вируса. Прочетете още: https://t.co/MPCevFV6SM https://t.co/ryk02jSGOR	yes	no	yes	no	no	no	no
755	Моля, запознайте се с: #BiddenHarris #Covid_19 план ще използва целия подход на правителството, за да се получи пандизията под контрол. #WearAmask https://t.co/cil4YinkeDz	yes	no	yes	no	no	no	no
756	Трябва да сме в Concordia Luteran Church в Brevard County, за да обявим допълнителен ваксинационен сайт, който ще предостави на Johnson &ham; Johnson ваксини в продължение на повече от четири дни до възраст 65 и повече години. Още тук - https://t.co/Jg3GSSFCvusX https://t.co/HHHHGMLGGGGXZA	yes	no	yes	no	no	no	no
757	Operation Warp Speed laids с продължителност повече от два месеца, за да одобрят план за разпределение и администриране Covid-19 ваксини, предложени от здравните служители на САЩ, представители на администрацията заявиха, че https://t.co/pwcoXO17IR	yes	no	yes	yes	no	no	no
758	Но истината е, че тяхната ваксина, както всички COVID: COVID-19 #vacinsines са неопровержими и могат или не могат да предотвратят COVID-19. https://t.co/B7Pgayyudn0 Доказателства в моя блог.	yes	nan	yes	yes	yes	yes	yes
759	Държавата се превърна в лидер в бързото ваксиниране на своите жители, като се възползва от връзките с племенните здравни организации. изисквания https://t.co/ZIgp9on2AW	yes	no	yes	no	no	no	no
760	"Д-р Ашиш Йеха казва на: ""сега имаме доста висока степен на сигурност"", че Ковид ваксините намаляват предаването и казва, че най-доброто му предположение е, че те намаляват предаването с 70-90%. https://t.co/Gf1Yxen5pf"	yes	no	yes	no	no	no	no
761	От СТО: https://t.co/tHLLPGjC8Didal Q&amp;A from Human Rights Watch: https://t.co/zNzzrT6D	yes	nan	yes	yes	yes	yes	yes
762	В представеното от Индия и Южна Африка предложение се отправя призив към СТО временно да се откаже от правата върху интелектуалната собственост на ваксините и да сезира Covid-19: https:://t.co/v1DstMUQA	yes	no	yes	no	no	no	no
763	Южна Африка, Индия и повече от 100 други страни призоваха Световната търговска организация временно да се откаже от патенти за COVID-19 ваксини https://t.co/vxEn8RURWWr https://t.co/ULseR92f	yes	no	yes	no	no	no	no
764	FDA е определила цел за Covid- 19 клинични проучвания за ефикасност от най- малко 50% и доверителен интервал, който не е по- нисък от 30%.	yes	no	yes	no	no	no	no
765	Ние също така обсъждаме регулаторните пътища, подобни на тези на грипната ваксина за адаптиране на ваксините, ако е необходимо. https://t.co/13moUoO	yes	no	yes	no	no	no	no
766	За десетки смъртни случаи е съобщено на федералното правителство сред лицата, които са получили COVIDID-19 в Охайо, но властите заявиха, че няма доказателства, че ваксинацията е допринесла за смъртните случаи. https://t.co/ApyyzhoJbk	yes	no	yes	no	no	no	no
767	ДЕЙСТВИЕ: В Ричмънд и Анрико Health District днес ще започнат да се регистрират хора в останалата част от Фаза 1Б за COVID- 19 ваксини, включително тези 16-64 с предходни условия.	yes	no	yes	no	no	no	no
768	Днес в V.R.Multi Speciality Hoспистна болница, Kurnool. Поздрави на нашите учени и лекари за техните усилия. Те развиха ваксина в най-кратки срокове. Също така, призовавам всички да вземат ваксина.	yes	no	yes	no	no	no	no
769	Ако се предположи, че AZZZ/AZ/Covishididididd, които се използват в	yes	no	yes	no	no	no	no
770	Това би трябвало да е безскрупулно.	no	nan	nan	nan	nan	no	yes
771	Бивши западни Индийци капитан Г-н Г-н Ви Ви Ричардс и други играчи да благодарят на премиера Моди за подаръка на Индия от Covid-19 ваксини #VaccineMaitri #COVIDID19 #CovidVaccine #DraggestsstVacinDrive https://t.co/edivsZW45	no	nan	nan	nan	nan	no	no
772	Ваксините, които ще използваме в Нигерия са едни и същи ваксини, които се използват в САЩ, Великобритания, Великобритания, Израел, Франция, Германия и повечето европейски страни.	yes	no	yes	no	no	no	no
773	"Директорът на CD-a Dr Dr Dr. Walensky казва: ""Колкото повече вирус, който е навън и се възпроизвежда... толкова по-вероятно е вариантите да се появят."" Уоленски подчертава, че спирането на разпространението е от ключово значение за предотвратяването на варианти, които рискуват ефикасността на Covid-19. https://ttt.co/VenYirdU3w"	yes	no	yes	no	no	no	no
774	"Китай се справя много по-добре със споделянето на своята ""Съединена"" ваксина със света в сравнение със страните от Западните страни са: https://t.co/UBPbcHfy7n (via @bopinion)"	no	nan	nan	nan	nan	no	no
775	Този месец, две от най-добрите ваксини в Куба, Soberana 02 и Abdala, ще започнат клинични изпитвания в края на фазата и ще осъвременят производството, с имунизация на групите в края на март. https://t.co/zS1P3H4NYk https://t.co/zOUKDNg19Q	yes	no	yes	no	no	no	no
776	Лекарствата, одобрени за употреба в Обединеното кралство, са разработени от Pfizer/BioNTech и Oxford/AstraZeneca. Те отговарят на строгите стандарти за безопасност, качество и ефективност. Прочетете повече https://t.co/MPCevFV6SM	yes	no	yes	no	no	no	no
777	Русия, Китай и Иран са извършвали инфо операции за манипулиране на описания около #coronavirus ваксини. ASD анализирани &gt;35 000 съобщения, свързани с ваксината, заловени върху нашата Хамилтън, за да се разбере влиянието на тези действия. https://t.co/XvZjOhTFgs	yes	no	yes	yes	yes	yes	yes
778	Първият #COVAX COVIDID-документи, които пристигат на @lypethypypian тази сутрин. Поздравления, @lia_tadesse @FMoDood и @UNEthiopia на вашата глоба на национално и международно лидерство. Никой не е безопасен, докато всички не са сигурни.	yes	no	yes	no	no	no	no
779	- U.S. Центровете за контрол на заболяванията и профилактиката (КБН) съобщиха в сряда, че на хора, на които са давани пълни дози от коронавирусната ваксина, вече не е необходимо да бъдат поставяни под карантина след експозиция на някой с болест на COVID-19.	yes	no	yes	no	no	no	no
780	С напредването на доказателствата и появата на нови варианти на вируса, актуализираните #COVISID19 ваксини могат да бъдат необходими в бъдеще, за да се предпазят от тези варианти.	no	nan	nan	nan	nan	no	no
781	"Това, което искаме от тези ваксини, е да държим хората далеч от болницата и да пазим хората от умиране,"" - експертът по инфекциозните болести на БМК, @JaBarocas се намесва във въвеждането на нова #vacine, чрез @IBTimes: https://t.co/G2NappxAnRaO"	no	nan	nan	nan	nan	no	no
782	Един от основните приоритети сега е да се увеличи амбицията на #COVAX да помогне на всички страни да сложат край на пандемията, като увеличи производството на	yes	no	yes	no	no	no	no
783	Newly daate: Compaining the #COVIDID19 ваксини, разработени от Pfizer, Moderna и Johnson &amp; Johnson https://t.co/P4vBP5lwAj чрез @stats @HelenBranswell	no	nan	nan	nan	nan	no	no
